{
  "evidence_set_id": "EVSET-ORAL-HYGIENE-001",
  "evidence_set_type": "layer_assignment",
  "target_ref": "pressure-layer-taxonomy.example.json::driver",
  "target_text": "Bacteria is the driver in the oral hygiene decomposition for the phrase 'Brush your teeth twice a day.'",
  "evidence_status_summary": {
    "pending": 1,
    "cited": 1,
    "supported": 1,
    "contested": 0,
    "insufficient": 0,
    "missing": 0,
    "stale": 0,
    "superseded": 0
  },
  "evidence_references": [
    {
      "evidence_id": "EV-PENDING-ORAL-HYGIENE-001",
      "evidence_status": "pending",
      "claim_ref": "pressure-layer-taxonomy.example.json::driver",
      "claim_text": "Bacteria is the driver in the oral hygiene decomposition for the phrase 'Brush your teeth twice a day.'",
      "evidence_summary": "Evidence has not yet been attached. This reference records that the claim currently remains evidence-pending while semantic validation has passed under the domain-bound oral hygiene rule set.",
      "evidence_source": "not yet assigned",
      "source_type": "not_assigned",
      "evidence_scope": "oral hygiene domain; current source phrase; current pressure-layer semantic rule set",
      "evidence_family": "not_assigned",
      "evidence_role": "not_assigned",
      "supports_claim": "not yet determined",
      "limits_claim": "This evidence reference does not support universal claims about bacteria as a driver outside the current oral hygiene decomposition.",
      "weakness_note": "No dental, medical, microbiological, or public-health citation has been attached yet.",
      "conflict_note": "No conflict review has been completed.",
      "freshness_note": "Freshness cannot be evaluated until a source is attached.",
      "boundary_note": "Pending evidence does not invalidate the current semantic pass result, but it prevents GFC from claiming that the assignment is fully evidenced.",
      "issued_at": "2026-06-23",
      "expires_at": "",
      "reviewed_at": "",
      "reviewer_note": "Initial pending evidence reference for the first oral hygiene semantic validation example."
    },
    {
      "evidence_id": "EV-CITED-ORAL-HYGIENE-001",
      "evidence_status": "cited",
      "claim_ref": "pressure-layer-taxonomy.example.json::driver",
      "claim_text": "Bacteria is the driver in the oral hygiene decomposition for the phrase 'Brush your teeth twice a day.'",
      "evidence_summary": "A source placeholder has been attached for the oral hygiene driver claim. This example records citation presence only. It does not claim that the source has been reviewed for sufficiency, quality, freshness, or claim-to-source fit.",
      "evidence_source": "SOURCE_PLACEHOLDER_ORAL_HYGIENE_BACTERIA_DRIVER",
      "source_type": "public_health_source",
      "evidence_scope": "oral hygiene domain; current source phrase; current pressure-layer semantic rule set",
      "evidence_family": "not_assigned",
      "evidence_role": "support",
      "supports_claim": "not yet determined",
      "limits_claim": "Citation exists, but support has not yet been established. The citation must not be treated as proof that bacteria is universally a driver outside this decomposition.",
      "weakness_note": "The cited source has not yet been reviewed for relevance, sufficiency, specificity, or authority.",
      "conflict_note": "No counterevidence or conflicting source review has been completed.",
      "freshness_note": "Citation freshness has not yet been checked.",
      "boundary_note": "Cited evidence means a source has been attached. It does not mean the claim is supported.",
      "issued_at": "2026-06-23",
      "expires_at": "",
      "reviewed_at": "",
      "reviewer_note": "Initial cited evidence reference example. This intentionally preserves the boundary cited does not equal supported."
    },
    {
      "evidence_id": "EV-SUPPORTED-ORAL-HYGIENE-001",
      "evidence_status": "supported",
      "claim_ref": "pressure-layer-taxonomy.example.json::driver",
      "claim_text": "Bacteria is the driver in the oral hygiene decomposition for the phrase 'Brush your teeth twice a day.'",
      "evidence_summary": "For this example, the evidence reference is treated as supported within the current oral hygiene domain and current pressure-layer semantic rule set. This support is scope-bound and does not imply universal truth, complete dental science, or cross-domain validity.",
      "evidence_source": "SOURCE_PLACEHOLDER_ORAL_HYGIENE_BACTERIA_DRIVER_REVIEWED",
      "source_type": "public_health_source",
      "evidence_scope": "oral hygiene domain only; current source phrase only; current pressure-layer semantic rule set only",
      "evidence_family": "not_assigned",
      "evidence_role": "support",
      "supports_claim": "The reviewed source is treated as supporting the bounded claim that bacteria can function as the driver in this oral hygiene decomposition.",
      "limits_claim": "Support applies only to the current oral hygiene decomposition and does not establish bacteria as the driver in every health, biological, institutional, or governance context.",
      "weakness_note": "This is still a placeholder-supported example. Future versions must replace the placeholder with a real source and explicit citation review.",
      "conflict_note": "No conflicting evidence is recorded in this example. Future conflict review remains required.",
      "freshness_note": "Freshness is treated as not yet independently reviewed. Future evidence validation must check source date, currency, and continued applicability.",
      "boundary_note": "Supported evidence is scope-bound. It does not mean universal truth, final scientific completeness, legal legitimacy, or cross-domain validity.",
      "issued_at": "2026-06-23",
      "expires_at": "",
      "reviewed_at": "2026-06-23",
      "reviewer_note": "Initial supported evidence reference example. This intentionally preserves the boundary that supported evidence remains scope-bound."
    }
  ],
  "set_summary": "This evidence reference set bundles the pending, cited, and supported example evidence references for the oral hygiene driver claim. It demonstrates that multiple evidence statuses can attach to the same target while preserving distinct boundaries.",
  "set_limitations": [
    "This set uses source placeholders.",
    "This set does not validate real external citations.",
    "This set does not establish universal truth.",
    "This set does not prove medical, scientific, legal, or institutional support beyond the declared example scope.",
    "This set is a structural and boundary-validation artifact."
  ],
  "recommended_next_action": "review_support",
  "boundary_note": "An evidence reference set may contain pending, cited, and supported records together. The strongest record does not erase the limits of the weaker records, and supported evidence remains scope-bound."
}